{
  "task_id": "multi_round_cumulative_update",
  "task_family": "policy_synthesis",
  "sources": {
    "relevant": [
      { "id": "S1", "role": "adoption_trends" },
      { "id": "S2_current", "role": "reimbursement_policy" },
      { "id": "S3_current", "role": "compliance_constraints" },
      { "id": "S4_current", "role": "access_benefits" },
      { "id": "S5_current", "role": "cost_uncertainty" },
      { "id": "S6", "role": "clinical_fit" },
      { "id": "S7", "role": "adoption_limits" }
    ],
    "irrelevant_decoys": [
      { "id": "D1", "reason": "adjacent operational topic but not probative for the requested recommendation" },
      { "id": "D2", "reason": "plausible digital-health context but outside clinical and reimbursement scope" }
    ],
    "superseded": [
      { "old_id": "S4_old", "current_id": "S4_current", "superseded_claims": ["X2_universal_expansion"] }
    ],
    "conflicting_pairs": [
      { "source_ids": ["S4_current", "S5_current"], "required_tension_id": "T_access_vs_cost" }
    ]
  },
  "expected_claims": [
    { "id": "C2_reimbursement_targeted", "text": "Selected reimbursement support now justifies expansion for targeted behavioral-health and some chronic-care follow-up services, but parity is not universal.", "supported_by": ["S2_current"], "should_appear": true, "affected_by_edit": false, "required_in_final": true },
    { "id": "C3_compliance_state_clustered", "text": "Compliance constraints require state-clustered rollout rather than uniform multistate expansion.", "supported_by": ["S3_current"], "should_appear": true, "affected_by_edit": false, "required_in_final": true },
    { "id": "C4_access_segmented", "text": "Access benefits are strongest for behavioral-health follow-up and rural or mobility-limited patients.", "supported_by": ["S4_current"], "should_appear": true, "affected_by_edit": true, "required_in_final": true },
    { "id": "C5_cost_controls", "text": "Cost and utilization uncertainty still require triage and utilization controls, especially for chronic-care follow-up.", "supported_by": ["S5_current"], "should_appear": true, "affected_by_edit": false, "required_in_final": true },
    { "id": "C6_recommendation_interaction", "text": "The recommendation should prioritize behavioral-health follow-up and rural or mobility-limited segments while keeping chronic-care expansion more cautious, payer-validated, compliance-gated, and state-clustered.", "supported_by": ["S2_current", "S3_current", "S4_current", "S5_current", "S6"], "should_appear": true, "affected_by_edit": true, "required_in_final": true }
  ],
  "excluded_claims": [
    { "id": "X2_universal_expansion", "text": "Telehealth should be expanded uniformly across all service lines and states.", "reason": "stale", "contradicted_by": ["S3_current", "S4_current", "S5_current"] },
    { "id": "X3_system_wide_savings", "text": "Telehealth expansion is proven to generate system-wide cost savings.", "reason": "stale", "contradicted_by": ["S5_current"] }
  ],
  "required_tensions": [
    { "id": "T_access_vs_cost", "description": "The output should preserve the tension between targeted access benefits and cost or overutilization risk.", "supported_by": ["S4_current", "S5_current"] }
  ],
  "workflow_dependencies": {
    "final_memo": {
      "allowed_artifacts": ["claim_matrix.current", "tension_analysis.current", "recommendation_criteria.current"],
      "disallowed_context": ["full_raw_transcript", "superseded_sources", "irrelevant_decoys"]
    }
  }
}
